{
  "schema_version": 2,
  "contract_id": "contract-1",
  "project_id": "project-1",
  "object_version": 1,
  "status": "review",
  "creator_goal": "Create an evidence-bound travel recap",
  "audience": ["friends"],
  "platforms": ["youtube"],
  "target_duration": { "schema_version": 1, "value": 60, "timescale": 1 },
  "requirements": [{ "requirement_id": "req-1", "kind": "hard", "statement": "Use only approved trip footage", "priority": 100 }],
  "voice_and_identity": { "desired_traits": ["warm"], "forbidden_misrepresentation": ["invented location"] },
  "privacy_policy_ref": { "object_id": "privacy-local", "object_version": 1, "digest": "aaaaaaaaaaaaaaaaaaaaaaaaaaaaaaaaaaaaaaaaaaaaaaaaaaaaaaaaaaaaaaaa" },
  "rights_policy_ref": { "object_id": "rights-local", "object_version": 1, "digest": "bbbbbbbbbbbbbbbbbbbbbbbbbbbbbbbbbbbbbbbbbbbbbbbbbbbbbbbbbbbbbbbb" },
  "approval_policy": { "mode": "explicit_user", "actor_kind": "user" },
  "protected_refs": [],
  "allowed_transformations": ["trim", "reorder"],
  "forbidden_outcomes": ["fabricated fact"],
  "created_at": "2026-08-23T00:00:00.000Z",
  "provenance": { "producer": "interview", "source_id": "local-interview", "source_version": "1", "policy_version": "local-v1", "input_refs": [], "unresolved_assumptions": [] }
}
